,City,Location,Job_Title,Company,Salary,Description
110,Los Angeles,"Los Angeles, CA",Senior Research Analyst,Tessie Cleveland Community Service Corporation,56000.0,Technical Skills in Data Collection/Analysis and Database Management/Development. The Research and Evaluation Department at TCCSC is seeking a Senior Analyst to...
111,Los Angeles,"Los Angeles, CA",Quantitative Analyst - Multiple Vacancies,Selby Jennings,120000.0,A Top Tier Investment Bank is looking for an experienced risk quant to join their Global Analytics team. This person will be Responsible for independently
112,Los Angeles,"Los Angeles, CA 90046",Sr. Data Science Manager,Soothe,125000.0,"Lead a team of talented Data Scientists in developing high-quality, robust predictive algorithms. The Senior Manager of Data Science will lead Soothe’s Data..."
113,Los Angeles,"Los Angeles, CA","CHIEF RESEARCH ANALYST, BEHAVIORAL SCIENCES",Los Angeles County Human Resources,84495.5,Research experience working with quantifying survey data reliability in sampling size determination for health-related data collection....
114,Santa Monica,"Santa Monica, CA 90404",Director of Data,Career Movement,185000.0,"ResponsibilitiesImplement and lead continuous improvement to the company’s data strategy and architectureLead data engineering activities, including requirement..."
115,Los Angeles,"Los Angeles, CA","CHIEF RESEARCH ANALYST, BEHAVIORAL SCIENCES",Los Angeles County Department of Human Resources,84495.5,Research experience working with quantifying survey data reliability in sampling size determination for health-related data collection....
116,Los Angeles,"Los Angeles, CA",Senior Java Developer,LT,180000.0,"Our data team consists of two data analysts and three data scientists. My client a leading mobile application company located in Los Angeles, CA is looking for..."
117,Pasadena,"Pasadena, CA",LC/MS Clinical Laboratory Scientist,Lighthouse Recruiting,95000.0,"Join our Medical Laboratory Scientists Groups:. And also performing quantitative analysis, data review and certifying and releasing results...."
118,Los Angeles,"Los Angeles, CA",Director of Research and Data Analysis for the Board of Educ...,Los Angeles Unified School District,94900.0,And Data Analysis for the Board of Education:. A) Your professional experiences gathering various complex data sets....
119,Los Angeles,"Los Angeles, CA",Clinical Laboratory Scientist (CLS),"Exact Staff, Inc.",90000.0,"Current California Clinical Laboratory Scientist license. Maintains accurate department records, reports and statistical data as required...."
120,Los Angeles,"Los Angeles, CA",SENIOR STATISTICAL CLERK,Los Angeles County Human Resources,42566.5,"Compiles pertinent data to verify amounts, totals, and ensure balances. Participates in the coding, sorting, translating, and filing of data for statistical..."
121,Los Angeles,"Los Angeles, CA",SENIOR STATISTICAL CLERK,Los Angeles County Department of Human Resources,42566.5,"Compiles pertinent data to verify amounts, totals, and ensure balances. Participates in the coding, sorting, translating, and filing of data for statistical..."
122,Los Angeles,"Los Angeles, CA",SDET Engineer,LT,200000.0,Our data team consists of two data analysts and two data scientists. My client a leading mobile application company located right here in the beautiful Los...
123,Atlanta,"Atlanta, GA",Mathematical Statistician,Centers for Disease Control and Prevention,101553.5,"And collecting, analyzing, and interpreting scientific data for. Design and develop mathematical statistical models, methods, and/or techniques such as sample..."
124,Atlanta,"Atlanta, GA",Health Scientist,Centers for Disease Control and Prevention,120002.5,"Lead scientists and program consultants in various aspects of the study or survey design process, and other study support duties including analyzing and..."
125,Atlanta,"Atlanta, GA",Health Scientist (Informatics),Centers for Disease Control and Prevention,120002.5,As a Health Scientist (Informatics) you will:. Data and Information Synthesis Use relevant primary and secondary research findings to make action-oriented...
126,Atlanta,"Atlanta, GA",Statistical Data Analyst,Ga. Dept. of Admin. Services,41000.0,Strong data research and analysis skills for the position of Statistical Data. To determine and map source to target data and documents data cleansing rules....
127,Atlanta,"Atlanta, GA",Behavioral Scientist,Centers for Disease Control and Prevention,120002.5,As Behavioral Scientist you will:. Develop metrics and analyze data to assess programmatic processes and outcomes....
128,Atlanta,"Atlanta, GA 30308 (Old Fourth Ward area)",Lead Data Scientist,Stackfolio,80000.0,We are looking for a bright and experienced data scientist that has experience building web-based applications and systems to join our team as an early...
129,Atlanta,"Atlanta, GA 30326 (Buckhead area)",Sr Data Scientist,"eHire, LLC",150000.0,Senior Data Scientist*. A strong understanding of data profiling and data cleansing techniques. The Senior Data Scientist is responsible for collecting data and...
130,Roswell,"Roswell, GA",Senior R&D Statistician,Principle Solutions Group,130000.0,"R&D Statistician to assist with the research and development of new data sources. You will be responsible for the development of new credit models, identifying..."
131,Norcross,"Norcross, GA",Business Research Analyst - Entry Level,CI Radar,31000.0,Who We Are CI Radar is the premier provider of competitive intelligence services for B2B (business to business) companies. We help both startups and Fortune
132,Atlanta,"Atlanta, GA",Lead Quantitative Analyst,SearchBankingJobs,177500.0,"The client is looking for talented individuals who love data, love solving business problems, and want to see their recommendations in action...."
133,Atlanta,"Atlanta, GA 30341",Associate Research Analyst,CSTE,51706.0,"Skills with developing and presenting epidemiologic data; For more than six decades, the Council of State and Territorial Epidemiologists (CSTE) and the Centers..."
134,Atlanta,"Atlanta, GA",Epidemiologist,Centers for Disease Control and Prevention,101553.5,Assessment of the adequacy and quality of data used in the analyses; Participate in the synthesis of social science and epidemiologic data to be applied toward...
136,Atlanta,"Atlanta, GA","Scientist, Med Imag Analysis",Emory University,69900.0,"The Medical Image Analysis Scientist, works with Emory Radiology & Imaging Sciences faculty to help develop image analysis and image understanding algorithms..."
137,Norcross,"Norcross, GA 30092",Data Scientist (Data Science R&D),CareerBuilder,10000.0,"Data Scientist (Data Science R&D). The Data Science R&D team is composed of Data Scientists with expertise in areas such as Machine Learning, Applied Statistics..."
138,Atlanta,"Atlanta, GA",Market Research & Sales Analyst,Interesse International Inc,65000.0,Estimate numerical data; Must see through the data and analyze data to find conclusion; Works with large amounts of data:....
139,Atlanta,"Atlanta, GA",Sponsored Research Financial Analyst,Emory University,66700.0,"Responsible for post award processing of grants and contracts in the Office of Grants & Contracts. Provide account management, reconciliation, and resolution"
140,Alpharetta,"Alpharetta, GA",School Business & Human Resources (HR) Manager,Amana Academy Charter School,34999.5,Accounts Receivables - data entry. Invoice data entry once approved. Our intent is to “push down the 4 walls of the school” by taking students out into the...
141,Atlanta,"Atlanta, GA",Audit Snr (Banking) - Data Analysis 60K-80K,Synergy Search Group,80000.0,"Duties will include data conversion from multiple systems into analytical software such as ACL, using data analytical techniques to validate the integrity of..."
142,Smyrna,"Smyrna, GA 30082",Certifying Scientist,Lighthouse Recruiting,62500.0,A growing clinical toxicology laboratory is seeking a Certifying Scientist with strong chromatography skills to perform quantification and data review....
143,New York,"New York, NY",Senior / Director Data Science,Beeswax,147500.0,"A minimum of 5 years experience in Machine learning, large-scale data mining, or applied data science. We’re seeking a senior data scientist in New York City to..."
144,New York,"New York, NY",Chief Data Scientist - Consulting,Harnham,220000.0,Chief Data Scientist - Consulting. Chief Data Scientist | Data Science | Insurance | Management Consulting | Project Management | Statistical Modeling....
145,New York,"New York, NY",Data Scientist - Financial Services,Harnham,150000.0,"Data Scientist - Financial Services. Our client is interested in hiring a Data Scientist, essentially with experience analyzing financial and econometric data..."
146,New York,"New York, NY",Data Scientist,Big Cloud,150000.0,"Are you an experienced, talented and creative Data Scientist who likes solving complex problems? An exciting, innovative company in the heart of New York are..."
147,New York,"New York, NY",Wade & Wendy_Data Scientist/Engineer,Wade & Wendy,100000.0,"Our Data Scientist will integrate data from web sources, real-time adaptive questioning, and human-intelligence, to develop algorithms that create smart..."
149,New York,"New York, NY",Data Scientist,Workbridge Associates,120000.0,"An exciting start up located in the heart of Midtown NYC is looking to hire a full-time Data Scientist, paying up to $135k...."
150,New York,"New York, NY",Data Scientist,VROOM,115000.0,"As one of Vroom’s first data scientists you will be instrumental in establishing a data driven culture across the company, in creating data standards and..."
151,New York,"New York, NY",Quantitative Analyst for Global Quant Fund,Averity,225000.0,Examine and analyze data to increase alpha and decrease risk. Industry leading multi-billion dollar quant fund looking for Analysts that can drive quantitative...
152,New York,"New York, NY",Senior Data Scientist (Media),Averity,150000.0,We are looking for a Senior Data Scientist excited about the thought of heading up our new Data Science group....
153,Long Island City,"Long Island City, NY",Sr. Data Scientist for Global Organization,Averity,100000.0,Data Scientist to join our company's Operational Analytics team. This is an opportunity for an experienced Data Scientist to use your passion for advanced...
154,New York,"New York, NY",Junior Data Scientist (2 Years Experience),Averity,85000.0,"We prefer Data Scientists with a Master's Degree. As an experienced Junior Data Scientist on our team, you will be utilizing your machine learning skills with..."
155,New York,"New York, NY",Quantitative Analyst,StreetID,120000.0,Professional or academic experience working with large/noisy data sets. The emphasis here will be on hiring exceptional talent with a passion for turning...
156,New York,"New York, NY",City Research Scientist II,City of New York,77975.0,"City Research Scientist II. OER also addresses key policy-relevant research questions, with research activities that include statistical analyses of..."
157,New York,"New York, NY 10167 (Midtown area)",Research Scientist - High Frequency Trading,Selby Jennings,212500.0,Research Scientist - High Frequency Trading. An opportunity exists for an exceptional research scientist with a proven track record of cutting edge research...
158,New York,"New York, NY",Data Scientist / Python Developer,"The Hagan-Ricci Group, Inc.",250000.0,New York City financial services firm is seeking an experienced Data Scientist with strong Python development skills to work collaboratively with quants and IT...
159,New York,"New York, NY",Tableau Developer,Averity,80000.0,"As a Tableau Developer in our Data Science team, you will be work in collaboration with our data scientists to help our company maintains its status as the..."
160,New York,"New York, NY 10167 (Midtown area)",C++/Python Algo Developer/Data Scientist,Selby Jennings,135000.0,"Previous knowledge of data structures and standard algorithms. My client, a leading investment bank located in midtown Manhattan, is looking for a strong C++..."
161,New York,"New York, NY 10167 (Midtown area)",FTR Quantitative Risk Analyst,Selby Jennings,135000.0,A top global commodities company is seeking an FTR Quantitative Analyst with specific experience within the power space. This is a great opportunity to work
162,New York,"New York, NY",Quantitative Finance Analyst,FusionFind,150000.0,"Responsible for independently conducting quantitative analytics and complex modeling projects. Leads efforts in development of new models, analytic processes"
163,New York,"New York, NY",Senior Data Scientist for Hedge Fund,Averity,200000.0,"Are you Senior Data Scientist looking to join a Multi-Billion Dollar Hedge Fund? Experience with Big Data Concepts (Hadoop, Spark)...."
164,New York,"New York, NY",Data Scientist for a growing cyber security company located...,Workbridge Associates,125000.0,The data scientist will develop algorithms and analytic solutions to prepare for research and development testing....
165,New York,"New York, NY",REVENUE ANALYST (STATISTICAL/ TIME SERIES ANALYSIS BACKGROUN...,Parker and Lynch,87500.0,Data analysis which includes working with large pools of data and manipulating information to perform analysis for management....
166,New York,"New York, NY 10018 (Clinton area)",Lead Data Engineer,ingenium,200000.0,Lead and manage a team of data engineers and scientists working on firm's data pipeline. Data - Lead Software Engineer....
167,New York,"New York, NY",Data Scientist,Smith Hanley Associates,82500.0,Missing data imputation. Conduct basic research that draws on existing company data to study different aspects of consumer reporting performance and POS data...
168,New York,"New York, NY 10017 (Midtown area)",FinTech Data Analyst / Scientist,Integrated Management Resources,120000.0,"Big Data, Data Analysis. Provide expertise in big data analytics, data mining and regulations surrounding data transport...."
169,New York,"New York, NY",Data Scientist,TW Staffing Solutions,199000.0,"Data Scientist - New York (total compensation $199,000). Obtain a solid fundamental knowledge into Big Data research, gaining high level exposure to multiple..."
170,New York,"New York, NY 10167 (Midtown area)",Quantitative Research – Machine Learning,Selby Jennings,200000.0,"Extract and analyze data from large, complex data sets. Experience manipulating large, complex data sets. Fluency in some selection of programming languages and..."
171,New York,"New York, NY",Modeler/Policy Analyst,NYC Department of Finance,73357.0,"Strong programming, data analysis, statistical sampling and data mining experience. Prepare reports and respond to ad-hoc queries, data and reporting requests...."
172,New York,"New York, NY",Equity Research Analyst - Power & Utilities,Spencer Ogden,115000.0,"Urgently seeking Equity Research Analysts, specifically with Power experience, to work for a Private Equity firm within Power and EnergyTech Industry. More"
173,New York,"New York, NY",Research Analyst,Pro Partners Staffing,80000.0,Collect returns and exposure data for performance attribution and risk analysis. We are seeking a manager research analyst for a full-time position with an...
174,New York,"New York, NY 10167 (Midtown area)",Quantitative Analyst - Credit Risk,Selby Jennings,120000.0,A Top Tier Investment Bank is looking for an experienced risk quant to join their Global Analytics team. This person will be Responsible for independently
175,New York,"New York, NY 10167 (Midtown area)",Hedge Fund Data Scientist,Selby Jennings,150000.0,Senior Data Scientist. A hedge fund with over 11 billion in AUM in NYC is looking for an experienced Data Scientist with an impressive educational background...
176,New York,"New York, NY",Senior Data Scientist,Workbridge Associates,125000.0,This role is for a Senior Data Scientist who has previous leadership experience and is capable of hiring addition Data Scientists as the role grows....
177,New York,"New York, NY 10016 (Gramercy area)",Research Analyst,Green Key Resources,80000.0,"Screen marketplace quality through analysis of data points, analysis of third party reporting and manual checks of publishers and data sources...."
178,New York,"New York, NY 10018 (Clinton area)",Data Scientist,Princeton Consulting,150000.0,Ability to visualize and communicate data science concepts to other team members and the business. With that being said an ideal candidate should have...
179,New York,"New York, NY",Senior Machine Learning Engineer,Workbridge Associates,140000.0,"Experience with data manipulation:. Big Data experience such as Hadoop, Spark, Scala, or Cassandra. One of the most successful and industry leading company has..."
180,New York,"New York, NY 10039 (Harlem area)","Senior Scientist, Upstream Biologics Process Development",Laguna Source,100000.0,"In this role, you will be a key contributor as well as leading Project Teams comprised of dynamic, highly technical Engineers and Scientists...."
181,Brooklyn,"Brooklyn, NY 11223 (Gravesend-Sheepshead Bay area)",Certifying Scientist / Toxicologist,Lighthouse Recruiting,67500.0,"Join our Medical Laboratory Scientists Groups:. Reviews drug confirmation data from the laboratory, compares with the initial screening data for accuracy and..."
182,Long Island City,"Long Island City, NY 11101",Field Researcher,New York City Department of Health and Mental Hygi...,68239.0,"Two years as a City Research Scientist Level I can be substituted for the experience required in ""1"" and ""2"" above...."
183,New York,"New York, NY 10022 (Midtown area)",Quantitative Analyst (Fundamental Quant Equities) - Hedge Fu...,Datacom Technology Group,200000.0,"Should have experience conducting empirical research and working with large fundamental data sets. Will analyze and interpret relevant data, use valuation..."
184,New York,"New York, NY",Lead / Senior Data Scientist for Digital Media Company,Averity,175000.0,"Are you a Senior Data Scientist looking to lead and grow our company's newly formed Data Science team? As a Senior / Lead Data Scientist, you will be leading..."
185,Brooklyn,"Brooklyn, NY 11236 (Canarsie area)","Director of Data Analysis, DCP",New York City Department of Education .,71764.0,Ensure data integrity in reporting. The Director of Data Analysis will report to the DCP Chief of Staff and assume responsibility for managing the data...
186,New York,"New York, NY",Lead Data Scientist,Net-Consultants,160000.0,"Guide junior data scientists in aggregating and exploring applicant data to test statistical hypotheses. Our client, a small, early stage, high growth company..."
187,New York,"New York, NY 10167 (Midtown area)",Data Scientist Hedge Fund New York,Selby Jennings,157500.0,Data Scientist/Data Engineer. A well established hedge fund in New York City is looking to bring on a talented data scientist to their data team....
188,New York,"New York, NY",Executive Director of Data Engineering (Media),Averity,215000.0,"Enabling our Data Scientists to create products easier with our data. First and foremost, as the Executive Director of Data Engineering, you will be leading our..."
189,New York,"New York, NY 10167 (Midtown area)",VP of Data Science & Analytics,Selby Jennings,175000.0,VP Data Science & Analytics. This highly collaborative Adtech firm is seeking a seasoned Data Science business leader to oversee a team of over 10 Analysts and...
190,New York,"New York, NY",Senior Research Worker - Endocrinology,Columbia University,,"The incumbent is also expected to assist in data collection. In addition, the incumbent will perform the necessary quality controls to monitor the material..."
191,New York,"New York, NY",Executive Director of Data Engineering,Averity,215000.0,"Enabling our Data Scientists to create products easier with our data. First and foremost, as the Executive Director of Data Engineering, you will be leading our..."
192,New York,"New York, NY","Data Scientist - Text Analytics - SQL, R, SAS",Geode Executive Search,200000.0,"Data Scientist - Text Analytics - SQL, R, SAS*. The ~600 person company has a relatively new Data Analytics department, which has the responsibility of..."
193,New York,"New York, NY",Senior Research Staff Assistant,Columbia University,50000.0,"Work with scientists to conduct quality control, integrate and interpret data. Process and analyze airborne geophysical data including potential field data...."
194,Long Island City,"Long Island City, NY 11101",Senior Analyst (Biostatistician or Epidemiologist),New York City Department of Health and Mental Hygi...,88331.0,"-Experience with inferential statistical analyses, publishing peer-reviewed articles, study design, data manipulation, surveillance/health data, and grant..."
195,New York,"New York, NY",climate scientist,Research Foundation of The City University of New...,61500.0,"Experience with data analysis and statistical software, such as R, IDL, Matlab, etc. Experience in analysis of climate data and GCM/RCM output for developing..."
196,New York,"New York, NY","Director, Data Scientist Modeler",Harnham,180000.0,"Director, Data Scientist Modeler. Essentially as a Data Scientist Modeler -Director and senior professional, you will always be required to solve challenging..."
197,New York,"New York, NY",Senior Data Scientist for Humanitarian Organization,Averity,127500.0,Are you a Senior Data Scientist who is passionate about big data and looking to make a real difference in the word?...
198,New York,"New York, NY 10065 (Upper East Side area)",Blood Bank QC Technologist,Lighthouse Recruiting,58000.0,Join our Medical Laboratory Scientists Groups:. This position will perform hematological pre and post testing on specimens received from the collection sites...
199,New York,"New York, NY 10016 (Gramercy area)",Senior Data Scientist for Fortune 500 Company,Averity,107500.0,"As a Data Scientist, you will be proficient in SAS and SQL and will utilize your big data and predictive modeling skills to analyze and interpret massive..."
200,New York,"New York, NY",Senior Technician - CLM,Columbia University,,He/she will be responsible for maintaining all data in an organized fashion and managing supplies for the lab....
201,New York,"New York, NY",Research Staff Assistant,Columbia University,40480.0,"Processes, organizes and summarizes data, reporting experiment results using a variety of scientific, word processing, spreadsheet or statistical software..."
202,New York,"New York, NY",Big Data Analytics Engineer,Averity,100000.0,"As a Data Engineer in our Data Engineering team, you will be work in collaboration with other data engineers and data scientists to help our company maintains..."
203,New York,"New York, NY 10167 (Midtown area)",VP Data Scientist,Selby Jennings,175000.0,VP Data Scientist. A top investment bank in New York City is looking for a VP-level Data Scientist to join their Data Science Division....
204,New York,"New York, NY",Health Scientist,Centers for Disease Control and Prevention,117437.5,Analyze scientific investigation data. The Centers for Disease Control and Prevention (CDC) is the agency Americans trust with their lives....
205,New York,"New York, NY 10016 (Gramercy area)",Quantitative Analyst,Green Key Resources,195000.0,"Qualifications Masters in Mathematics, Physics or Quantitative Finance 7+ years of relevant experience in Risk, Modelling or related industry Attention to"
206,New York,"New York, NY",Big Data Engineer,Harnham,110000.0,You will join the data engineering team and work closely with the data scientists as well. Big Data Engineer....
207,New York,"New York, NY 10167 (Midtown area)",Senior Equity Research Analyst,Selby Jennings,175000.0,Senior Equity Research Analyst The firm is expanding their Equity Research department and looking for highly experienced Sell Side Equity Research Analysts
208,New York,"New York, NY 10167 (Midtown area)",Catastrophe Risk Analyst - Quantitative,Selby Jennings,97500.0,This is for a Portfolio Analyst with one of the world’s largest asset managers - dedicated to natural catastrophe and weather related risk. Responsibilities
209,New York,"New York, NY",Sr. Quantitative Finance Analyst,Next Generation Recruitment & Staffing Agency,160000.0,"Our client, a leader financial institution Bank of America, is seeking a Sr. Quantitative Finance Analyst in NEW YORK, New York. Job description Responsible"
210,New York,"New York, NY","Analyst, Strategy & Insights – Custom Research - copy",Univision communications inc,55000.0,"Infographics, visual data representation skills a plus. Comfortable working with large data files and cross tabs...."
211,New York,"New York, NY",Quantitative Business Analyst,JEG Search,60000.0,The ideal candidate would have business analysis skills honed in a consulting or technology company where data analysis is a core activity....
212,New York,"New York, NY",Research Analyst,Investment Management Services,65000.0,Responsibilities: The candidate will assist the partners in all aspects of investment research. This includes: • ; Performing regular portfolio reviews
213,New York,"New York, NY",Data Scientist,Talon,120000.0,Our client is looking for a highly driven and experienced Data Scientist to join our team in building out the core ranking and recommendation algorithms in our...
214,New York,"New York, NY",Director of Data Science - Remote Role,Workbridge Associates,165000.0,"Experience with Python, R, Machine Learning with a Data Scientist background. Hands on experience with Big Data Tools(Spark) and latest technologies...."
215,New York,"New York, NY",Business Analyst - Supply,VROOM,120000.0,Work with our Data Scientists to develop proactive acquisition models and machine learning algorithms to identify supply and demand....
