,City,Location,Job_Title,Company,Salary,Description
216,Orangeburg,"Orangeburg, NY","Research Scientist 5 - part time, Nathan Kline Research Inst...","Mental Health, Office of",26143.0,"This person will lead grant writing efforts to secure federal, private, and government funding for robust research and evaluation, manuscript development, and..."
217,New York,"New York, NY",Technician B - Nephrology,Columbia University,,The technician will also analyze DNA and RNA sequence data and will gain exposure to analysis and validation of Next-Generation Sequencing data....
218,New York,"New York, NY",Big Data Analytics Engineer/ ETL Developer,Averity,105000.0,"As a Data Engineer in our Data Engineering team, you will be work in collaboration with other data engineers and data scientists to help our company maintains..."
219,New York,"New York, NY 10167 (Midtown area)",VP Data Science | Top Bank,Selby Jennings,177500.0,VP Data Scientist. A leading bank is looking for experienced VP-level Data Scientists to join a new and innovative data science group in their NYC headquarters....
220,New York,"New York, NY","Manager, Business Development Operations",AiCure,80000.0,"You'll work with Scientists, Engineers, Designers, and Medical Doctors, to create innovative products that scale in an environment that encourages learning,..."
221,New York,"New York, NY",VP of Data,Harnham,190000.0,VP of Data. The data team's mission is to provide the highest level of service to the community through analysing and researching all aspects of data and...
222,New York,"New York, NY 10016 (Gramercy area)",Data Analysis Specialist,Green Key Resources,195000.0,7+ years of relevant Data Governance experience. Contribute to the overall data governance strategy to ensure the meta data developed and composed supports the...
223,New York,"New York, NY 10167 (Midtown area)",Senior Quantitative Risk Analyst,Selby Jennings,200000.0,"Multinational Tier 1 Bank is looking to add to their Risk Modelling Group. In this role, you will be responsible for independently handling in-depth modelling"
224,New York,"New York, NY",Lead Data Scientist (New Jersey),Averity,140000.0,We are hiring a Lead Data Scientist for our growing Data Science team here at one of the world's largest and most respected companies....
